StartDate,EndDate,Status,Progress,Duration (in seconds),Finished,RecordedDate,ResponseId,RecipientLastName,RecipientFirstName,RecipientEmail,ExternalReference,DistributionChannel,UserLanguage,Q262,Q264,Q272_First Click,Q272_Last Click,Q272_Page Submit,Q272_Click Count,Q265,Q266,Q273_First Click,Q273_Last Click,Q273_Page Submit,Q273_Click Count,Q251,Q252,Q253,Q254,Q271,Q134,Q196_1,Q106,Q108,Q108_2_TEXT,Q268,Q268_2_TEXT,Q121,Q359,Q358,Q250,UserAgent,ResponseID
4/12/2022 3:43,4/12/2022 3:47,0,100,219,1,4/12/2022 3:47,R_2YbrTvUnjTHoo3A,,,,,anonymous,EN,"My girlfriend, it has changed her for the worst because of it. She's grown more entitled and looks down on people making less, even though those people helped get her where she is and financially supported her over it all.","Me, I was making decent until hour cuts and inflation. Now I scrape by and will have even less resources once she moves out.",12.206,105.847,106.184,3,,,,,,,6,6,3,3,1,3,6,33,1,,1,,42,1,3,4,"Mozilla/5.0 (Windows NT 10.0; Win64; x64) AppleWebKit/537.36 (KHTML, like Gecko) Chrome/108.0.0.0 Safari/537.36",R_2YbrTvUnjTHoo3A
4/12/2022 3:42,4/12/2022 3:48,0,100,353,1,4/12/2022 3:48,R_2sRbkFCn7g8U3ae,,,,,anonymous,EN,,,,,,,"The tallest person I know can do things others can't do, mainly reaching things high on shelves for themselves and others. They are also very strong despite not working out at all. However, I have been with them at an amusement park and some of the more tight rides they have trouble fitting into. They look quite uncomfortable with their knees often pressed against them. I can only imagine that this person faces the same problem on planes.","The shortest person I know feels like the complete opposite of the tallest person I know. They are not very strong but they have very high stamina and can walk long and difficult terrain without tire. They are able to fit comfortably in many places in this world, although rarely things will be too big. Although they cannot reach tall things, they can adeptly weave in and out of a crowd without being burdened.",2.214,128.734,235.677,6,6,7,7,1,1,2,5,27,0,,1,,5,5,5,2,"Mozilla/5.0 (Windows NT 10.0; Win64; x64) AppleWebKit/537.36 (KHTML, like Gecko) Chrome/108.0.0.0 Safari/537.36",R_2sRbkFCn7g8U3ae
4/12/2022 3:39,4/12/2022 3:48,0,100,549,1,4/12/2022 3:48,R_Bxni8dzBIW3DdcJ,,,,,anonymous,EN,They are able to do a lot of different things without having to worry about the financial burdens that they have. Things like vacations or things that seem like luxuries are easily without their reach and allows them to not worry about that kind of stuff,"They have to focus a lot on their finances and have very little ability to save or spend on necessities, let alone luxuries. It ends up influencing the work and day to day life a lot. ",19.99,289.607,343.729,8,,,,,,,6,5,7,2,1,2,7,25,2,Agender,1,,34,5,5,4,"Mozilla/5.0 (Windows NT 6.1; Win64; x64) AppleWebKit/537.36 (KHTML, like Gecko) Chrome/107.0.0.0 Safari/537.36",R_Bxni8dzBIW3DdcJ
4/12/2022 3:44,4/12/2022 3:49,0,100,289,1,4/12/2022 3:49,R_6WhWe2lfUAFV2vL,,,,,anonymous,EN,A neighbor Marty has the most economic resources. He and his wife can afford to go on cruises and long vacations. They travel internationally. They visit their son and daughter and grandchildren regularly. Marty has renovated his home. He has replaced his roof and his siding. He has landscaped his backyard into a flower and vegetable garden and goldfish pond with waterfall. Financial resources allow Marty to do whatever he wants to do.,"The person with the least economic resources is Ellie, a coworker. Ellie cannot afford a better apartment for themselves. Ellie cannot afford to travel to visit family and friends in another state. Ellie needs to save money to pay rent and bills. Financial resources control Ellie's life.",17.599,209.286,209.674,3,,,,,,,7,7,7,1,1,4,4,59,1,,1,,22,4,6,5,Mozilla/5.0 (Windows NT 10.0; Win64; x64; rv:107.0) Gecko/20100101 Firefox/107.0,R_6WhWe2lfUAFV2vL
4/12/2022 3:43,4/12/2022 3:49,0,100,329,1,4/12/2022 3:49,R_2P1AxW83PA28ZNk,,,,,anonymous,EN,,,,,,,"The tallest person can easily see over others, reach things that are out of reach for others, get clothes custom made, play sports. Tall people are often uncomfortable in tight places such as airplanes, trains or subways. They are often too long for standard beds, have to be in the back of the line by size order or often in the back for a lot of things due to their height. ","short people can wear high heels, fit small items and in small places, be carried or lifted, always in the front or let through by taller people. Short people cannot reach things and require assistance a lot to get things done in the home, kitchen or market.",21.543,139.607,207.678,6,5,4,5,2,2,4,6,33,0,,1,,8,4,6,2,Mozilla/5.0 (Macintosh; Intel Mac OS X 10.15; rv:106.0) Gecko/20100101 Firefox/106.0,R_2P1AxW83PA28ZNk
4/12/2022 3:43,4/12/2022 3:49,0,100,332,1,4/12/2022 3:49,R_1GCVSKfcR51ISia,,,,,anonymous,EN,,,,,,,"He has to duck to walk through certain doorways, but can reach things on the top shelf at the store. H can put things out of the sight of most people. He can also see the dust on top of the fridge.","She can not reach much of anything, and has to have people reach them for her. On the bright side, she is closer to the ground so falls are not as bad.",57.36,180.206,183.884,13,2,2,2,6,1,5,4,47,0,,1,,5,3,3,1,"Mozilla/5.0 (Windows NT 6.1; Win64; x64) AppleWebKit/537.36 (KHTML, like Gecko) Chrome/108.0.0.0 Safari/537.36",R_1GCVSKfcR51ISia
4/12/2022 3:40,4/12/2022 3:49,0,100,550,1,4/12/2022 3:49,R_3HFC1bmynMO1eEV,,,,,anonymous,EN,"The person that I know who has the most economic resources can go anywhere she wants at any time. She retired early and she can buy the best life has to offer. Although she has tried, she cannot buy friendship or love. Her access to wealth and the resources wealth provides makes her life easier in many ways, but she struggles in the ""love"" department.

","The person that I know with the least economic resources can't pay the simplest of bills and struggles to keep food on the table. But she has the most love in her life, and because of the love she receives from others, people help her keep her bills paid and her head ""above water"". ",21.085,396.094,397.068,40,,,,,,,7,6,7,1,1,2,4,39,0,,1,,11,5,5,5,"Mozilla/5.0 (Windows NT 10.0; Win64; x64) AppleWebKit/537.36 (KHTML, like Gecko) Chrome/108.0.0.0 Safari/537.36",R_3HFC1bmynMO1eEV
4/12/2022 3:43,4/12/2022 3:50,0,100,377,1,4/12/2022 3:50,R_VViWKl7T3pejqE1,,,,,anonymous,EN,"They cant relax because they are always worried about making more resources. They have a lot more to loose to theft, might end up having their house and car broken into. They have to be careful not to flaunt what they have. They can go on vacation, and do fun things because they have the resources to do so.","They cant afford to go out and have fun, or get devices they want because they lack resources. They have to be more conscious of how they spend their money on their day to day items. They can go out in public and not worry as much about someone wanting to steal from them because they dont look like someone with much to steal. ",11.113,241.205,264.591,20,,,,,,,7,7,7,1,7,3,2,30,0,,1,,49,1,2,5,"Mozilla/5.0 (Windows NT 10.0; Win64; x64) AppleWebKit/537.36 (KHTML, like Gecko) Chrome/107.0.0.0 Safari/537.36",R_VViWKl7T3pejqE1
4/12/2022 3:40,4/12/2022 3:50,0,100,609,1,4/12/2022 3:50,R_3PG06XPQz8lyqbh,,,,,anonymous,EN,My person with the most economic resources can do many things that the person with the least can do.  She can go on trips around the world if she chooses to do so.  She can pay off charges to any of her credit cards in full each month.  She is the smartest person that I know when it comes to money management.  She has all sorts of stocks and bonds and other money related things that I know nothings about.,I am probably the person with the least economic resources.  I worry about paying my rent and making groceries each month.  I struggle to pay my bills each month.  I am sometimes ashamed that I can't take care of my household needs each month.,37.627,299.23,326.246,6,,,,,,,7,4,7,1,1,4,3,69,0,,1,,11,1,3,4,"Mozilla/5.0 (Windows NT 10.0; Win64; x64) AppleWebKit/537.36 (KHTML, like Gecko) Chrome/107.0.0.0 Safari/537.36",R_3PG06XPQz8lyqbh
4/12/2022 3:42,4/12/2022 3:51,0,100,548,1,4/12/2022 3:51,R_dnSSEhhu0kHUH1D,,,,,anonymous,EN,"They are able to take vacations once a year, got to the spa whenever they want and have more than one car. Their finances influence their life because they are not limited to the amount of money they can spend.",They are not able to take vacations and they do not have a car; they have to use public transportation. Their finances influence their life because they are limited by the amount of money they can spend in a month. ,48.62,271.883,279.128,5,,,,,,,7,5,2,1,1,4,6,58,0,,1,,21,4,3,5,"Mozilla/5.0 (Windows NT 10.0; Win64; x64) AppleWebKit/537.36 (KHTML, like Gecko) Chrome/107.0.0.0 Safari/537.36 Edg/107.0.1418.62",R_dnSSEhhu0kHUH1D
4/12/2022 3:46,4/12/2022 3:51,0,100,295,1,4/12/2022 3:51,R_2Qufk75tQj6m8vA,,,,,anonymous,EN,"The person I know who has the most economic resources seems to have ample opportunities in their life. For example, they are able to attend the best schools, they are able to go to college debt free, and they are able to spend their leisure time traveling and seeing other parts of the world. For this person, it doesn't seem like they have many barriers, or any at all, when it comes to finances. Financial resources play a role in securing their spot in society and ensuring they have a good, secure future. ","The person I know who has the least economic resources has to live frugally. They live paycheck to paycheck, and much of every single paycheck has to be set aside for bills. They are able to budget well, and have a real understanding of what is valuable and important to them. They live on food stamps from the government as well, and are very grateful to be able to use this resource. Financial resources allow them to stay afloat. ",19.099,207.481,207.985,9,,,,,,,7,7,7,1,1,1,8,24,0,,1,,10,2,5,5,"Mozilla/5.0 (Windows NT 10.0; Win64; x64) AppleWebKit/537.36 (KHTML, like Gecko) Chrome/108.0.0.0 Safari/537.36",R_2Qufk75tQj6m8vA
4/12/2022 3:45,4/12/2022 3:52,0,100,426,1,4/12/2022 3:52,R_3RdVNWmChgEhUAx,,,,,anonymous,EN,,,,,,,They can reach any shelf. They usually feel safe in any environment. They probably feel more confidence then others. People most likely respect them more because people are simple and shallow. They probably have more trouble fitting on air planes and smaller cars.,"The shorter person has trouble reaching things on high shelves, seeing over people at concerts. They probably feel less safe in different environments since they are the shortest usually. They are more comfortable in airplanes and smaller cars. People probably do not respect them too much since they are short, because people can be shallow.",11.744,72.248,142.695,2,6,5,5,2,1,5,7,29,1,,1,,33,4,4,3,"Mozilla/5.0 (Windows NT 10.0; Win64; x64) AppleWebKit/537.36 (KHTML, like Gecko) Chrome/107.0.0.0 Safari/537.36",R_3RdVNWmChgEhUAx
4/12/2022 3:48,4/12/2022 3:53,0,100,315,1,4/12/2022 3:53,R_2b3nZv2ZmA8t57A,,,,,anonymous,EN,"The person who has the most economic resources is my uncle. He is very wealthy, has many investments, and has a very high paying job. Due to this, he never has to worry about paying for anything. He lives a very money-stress free life. He can buy whatever he needs whenever he wants it. ","The person with the least economic resources is my friend kait. She grew up well below the poverty line. Her parents were drug addicts that could not hold down a job. Due to this, she has shared with me that she often did not have enough food or clothes growing up as a child. She was unable to finish highschool and could therefore not get a job. She also could not have access to medical care and other needs. ",15.416,70.234,143.516,3,,,,,,,3,1,2,4,1,6,6,26,0,,1,,31,5,5,4,"Mozilla/5.0 (Macintosh; Intel Mac OS X 10_10_5) AppleWebKit/537.36 (KHTML, like Gecko) Chrome/87.0.4280.88 Safari/537.36",R_2b3nZv2ZmA8t57A
4/12/2022 3:50,4/12/2022 3:53,0,100,220,1,4/12/2022 3:53,R_2P6CBaEghXpb7cM,,,,,anonymous,EN,"they don't have to worry about having extra money to do 'fun' things - they can just do them without having to think. they're more free to worry about other things that aren't basic. they don't have to worry about if they can pay all their bills every month, have enough left over for food, etc.",this person can't go on as many vacations as they like. they can't even take a day off. their work has taken over their lives.,34.826,111.509,114.146,3,,,,,,,7,6,6,1,1,2,4,36,0,,1,,14,6,5,4,"Mozilla/5.0 (Macintosh; Intel Mac OS X 10_15_7) AppleWebKit/537.36 (KHTML, like Gecko) Chrome/107.0.0.0 Safari/537.36",R_2P6CBaEghXpb7cM
4/12/2022 3:47,4/12/2022 3:53,0,100,365,1,4/12/2022 3:53,R_9TZE40rlgOXt9m1,,,,,anonymous,EN,This person with economic resources can pretty much do anything they want to do. They take several vacations yearly as well as go out to eat very frequently to high end restaurants. They have their home cleaned regularly and it is always sparkling clean.,This person has very limited resources. Their trips out to eat are few and mostly to lower end fast food type restaurants. They shop for gifts at several local dollar stores. Sometimes they really want things for free.,34.761,192.855,225.78,4,,,,,,,5,4,5,4,1,6,5,69,0,,1,,36,2,3,4,Mozilla/5.0 (Windows NT 10.0; Win64; x64; rv:107.0) Gecko/20100101 Firefox/107.0,R_9TZE40rlgOXt9m1
4/12/2022 3:49,4/12/2022 3:54,0,100,265,1,4/12/2022 3:54,R_PTyGV0Tk9yJPuAp,,,,,anonymous,EN,,,,,,,They can reach things on high shelves. A lot of people ask them about their height and whether or not they play basketball which could get annoying. They are uncomfortable sitting in standard size plane seats and smaller cars. Standard size showers are a bit awkward to use. A lot of standard size clothes don't fit them.,They can't reach things on high supermarket shelves. They get teased a lot about being tiny. A lot of standard size clothes don't fit them. When driving it can be hard to get full visibility sometimes. They are sometimes seen as not as mature or not an adult because of their size.,8.806,112.588,157.263,4,7,7,7,1,1,1,8,41,0,,1,,31,5,5,2,"Mozilla/5.0 (Macintosh; Intel Mac OS X 10_15_7) AppleWebKit/537.36 (KHTML, like Gecko) Chrome/108.0.0.0 Safari/537.36",R_PTyGV0Tk9yJPuAp
4/12/2022 3:47,4/12/2022 3:54,0,100,446,1,4/12/2022 3:54,R_3JegHw00r4lIZ9z,,,,,anonymous,EN,,,,,,,"The tallest person I know can reach things high up, see over crowds, and helps them in their job being security guard, as it makes them seem more intimidating. It influences their lives by maybe intimidating people they don't intend to, being too tall for things, hitting their head off of things sometimes, shower heads being too low, bathtubs too small, and needing a longer bed.","I'm the shortest person I know. I never have a problem with leg room. People find it cute that I'm short. I can't reach things high up and have to climb on chairs, counters, or ask people to reach things for me. People make jokes and sometimes pretend to use my shoulders as an arm rest as a joke. I can't see over people if they sit in front of me at a concert.",20.696,157.461,317.626,2,7,3,4,1,1,2,4,29,0,,1,,39,1,3,3,"Mozilla/5.0 (Windows NT 10.0; Win64; x64) AppleWebKit/537.36 (KHTML, like Gecko) Chrome/107.0.0.0 Safari/537.36",R_3JegHw00r4lIZ9z
4/12/2022 3:42,4/12/2022 3:54,0,100,734,1,4/12/2022 3:54,R_1fZotCm1yqYYxNN,,,,,anonymous,EN,,,,,,,The person who is the tallest can reach things easier. He struggles to sit in small cars because of the space.,the person who is the shortest has to stand on chairs/items to reach things. They do not struggle fitting into small spaces/cars.,11.726,39.427,63.957,5,6,5,3,4,1,4,6,22,0,,1,,31,5,5,2,"Mozilla/5.0 (Windows NT 10.0; Win64; x64) AppleWebKit/537.36 (KHTML, like Gecko) Chrome/108.0.0.0 Safari/537.36",R_1fZotCm1yqYYxNN
4/12/2022 3:46,4/12/2022 3:54,0,100,481,1,4/12/2022 3:54,R_1psXUljhvuYtUve,,,,,anonymous,EN,,,,,,,"The tallest person I know is able to easily reach things that are high up, such as objects on the topmost shelf. They are also able to reach for things that are far away due to the length of their limbs.  However, their height limits the types of clothing that they are able to wear. They generally require more space to be comfortable, so furniture such as beds and couches must be larger to accommodate their height. They also suffer from back pain as a result of their height, which can prevent them from doing certain tasks. ","The shortest person I know is able to easily fit into and is more comfortable in smaller spaces than a taller person would be. They also have a wider range of clothes that would fit their body. On the other hand, they are unable to reach objects that are high up without the aid of another person or an object  that would make them taller, like a step stool. They also have trouble reaching things that are further away from them without getting up and walking over to the object in question. ",2.465,344.112,383.819,29,7,7,7,1,1,1,6,21,2,Non-binary,1,,29,2,3,2,"Mozilla/5.0 (Windows NT 10.0; Win64; x64) AppleWebKit/537.36 (KHTML, like Gecko) Chrome/108.0.0.0 Safari/537.36",R_1psXUljhvuYtUve
4/12/2022 3:49,4/12/2022 3:55,0,100,374,1,4/12/2022 3:55,R_9Z7yO7v9flxWztf,,,,,anonymous,EN,"I am not sure who has the most, but I will assume it is my dentist. He can own and drive and expensive car. He can choose to go on a vacation, with many options of time and cost.",The person I know with the least economic resources is in prison. There is much he cannot do. Some of his limits are economic. He has no income or savings. He has few choices in life.,9.072,108.693,242.647,3,,,,,,,6,5,3,3,1,4,5,42,1,,1,,51,3,5,5,"Mozilla/5.0 (Macintosh; Intel Mac OS X 10_14_6) AppleWebKit/537.36 (KHTML, like Gecko) Chrome/107.0.0.0 Safari/537.36",R_9Z7yO7v9flxWztf
4/12/2022 3:51,4/12/2022 3:55,0,100,277,1,4/12/2022 3:55,R_20Yh0vMM019395u,,,,,anonymous,EN,,,,,,,"Ted can clean the top of his cupboards without the assistance of a chair or climbing onto his countertops. His height also helped him throughout his high school basketball career. He towered over his opponents and many of our friends, which made strangers and newcomers often very intimidated by him.","Maxwell has never had the basketball career of Ted, but he sure could run fast. He was the high school track star and could outrun most of the other runners in the league. Maybe it didn't always help with his pursuit of the other sex, but he did fine and was never long without a girlfriend. Maxwell does tend to be argumentative with others when going out in public and gets into fights very often, and I've always wondered if he feels some sort of inferiority around others due to his stature.",26.866,139.436,167.153,3,7,7,7,2,1,1,4,39,1,,1,,5,2,3,2,"Mozilla/5.0 (Macintosh; Intel Mac OS X 10_13_6) AppleWebKit/537.36 (KHTML, like Gecko) Chrome/108.0.0.0 Safari/537.36",R_20Yh0vMM019395u
4/12/2022 3:52,4/12/2022 3:55,0,100,233,1,4/12/2022 3:55,R_aeLX6MGwUhodcXf,,,,,anonymous,EN,"They can do almost anything they want on a daily basis, as their money allows them to hire assistants who can further assist them with daily tasks and therefore free up their time. Their financial resources allow them to spend more time doing what they want to do rather than having to work.","Sadly, these people cannot always afford food and struggle to pay rent at times. Their free time is consumed by working additional jobs and childcare. They are merely trying to earn enough to survive. ",3.105,120.184,137.409,7,,,,,,,7,7,7,1,1,1,7,27,1,,1,,8,2,6,5,"Mozilla/5.0 (Windows NT 10.0; Win64; x64) AppleWebKit/537.36 (KHTML, like Gecko) Chrome/107.0.0.0 Safari/537.36 Edg/107.0.1418.62",R_aeLX6MGwUhodcXf
4/12/2022 3:50,4/12/2022 3:57,0,100,393,1,4/12/2022 3:57,R_2ErRdeRNvKJ0Gwo,,,,,anonymous,EN,They can afford to buy whatever they want or need. The bills are paid on time. Transportation is never a problem.,They can not afford to spend any money for anything that is not a necessity. They have to depend on others for their transportation needs. ,35.836,116.894,220.523,2,,,,,,,7,4,6,1,1,3,8,53,1,,1,,29,2,3,4,"Mozilla/5.0 (Windows NT 10.0; Win64; x64) AppleWebKit/537.36 (KHTML, like Gecko) Chrome/108.0.0.0 Safari/537.36",R_2ErRdeRNvKJ0Gwo
4/12/2022 3:50,4/12/2022 3:57,0,100,390,1,4/12/2022 3:57,R_XBcXafjbleCwunn,,,,,anonymous,EN,,,,,,,"They have difficulty getting into and out of small vehicles, even sedans at times, though they don't have any issues carrying items upstairs or grabbing hold of tall items. Their height makes it possible for them to really not have issues grabbing or reaching items, but it makes it far more difficult for them to get within tight spaces. It also makes it more difficult and expensive for them to purchase different things: more fabric to clothe themselves requires a higher cost, for example.","They don't have any issues getting into or out of tight spaces, especially if they are searching for items in a packed room. The penalty is that they have trouble reaching for things above their head, especially if they need something from a tall cabinet. They have much cheaper options for clothing and materials because they need less of it, though they have issues looking for a SUV that can accommodate their small size. ",0.902,166.59,281.502,8,6,6,6,1,2,3,4,36,1,,1,,11,3,5,2,"Mozilla/5.0 (Windows NT 10.0; Win64; x64) AppleWebKit/537.36 (KHTML, like Gecko) Chrome/108.0.0.0 Safari/537.36",R_XBcXafjbleCwunn
4/12/2022 3:45,4/12/2022 3:57,0,100,720,1,4/12/2022 3:57,R_1Gy9JH0GgxldC64,,,,,anonymous,EN,,,,,,,They can play basketball really good.He is very athletic and works as a fireman.,"There is a person that comes to mind when thinking short.She is just a very fair and kind person.In her case just being short makes her who she is,a very nice individual.",61.861,438.316,439.091,8,6,3,4,3,1,6,3,70,1,,1,,48,2,3,2,"Mozilla/5.0 (Linux; Android 11; SM-T510) AppleWebKit/537.36 (KHTML, like Gecko) Chrome/107.0.0.0 Safari/537.36",R_1Gy9JH0GgxldC64
4/12/2022 3:53,4/12/2022 3:58,0,100,292,1,4/12/2022 3:58,R_3POcKFjBksO9mYg,,,,,anonymous,EN,,,,,,,David Kubilius is the tallest person I know. He can't get into rooms with low ceilings and experiences minor difficulty with getting into his car. He was a basketball player for Columbia University.,My high school history teacher Alex Bates is the shortest person I know. She can barely be seen above the podium when she teaches or gives a speech or announcement.,2.182,85.135,128.054,9,7,7,7,1,1,2,4,22,1,,1,,36,2,3,2,"Mozilla/5.0 (Windows NT 10.0; Win64; x64) AppleWebKit/537.36 (KHTML, like Gecko) Chrome/107.0.0.0 Safari/537.36",R_3POcKFjBksO9mYg
4/12/2022 3:51,4/12/2022 3:59,0,100,450,1,4/12/2022 3:59,R_27rOjWJI9dr2gC3,,,,,anonymous,EN,"My boyfriend has the most economic resources.  He can afford rent and cover bills when I cannot.  They work full time and receive a salary as a wage.  They also get bonuses for what they can sell.  They can always afford everything from gas, to extra coffees and treats.  This influences their lives by having security in their mind and their wallets. ","I am the person I know with the least financial resources.  I have done a little bit college, and have a vocational degree but do not have a job in that area.  I work part time in a job that I enjoy, but do not make a lot of money at.  I can pay bills that are absolutely necessary, but cannot afford to have extras.  I cannot go out a buy a coffee, or purchase things for my hobbies because I need it for bills. My financial resouces influence my life by stresses me out and making me feel like a failure. ",15.623,329.247,339.363,7,,,,,,,6,6,6,3,1,2,4,26,0,,1,,3,7,3,4,"Mozilla/5.0 (Macintosh; Intel Mac OS X 10_15_7) AppleWebKit/537.36 (KHTML, like Gecko) Chrome/107.0.0.0 Safari/537.36",R_27rOjWJI9dr2gC3
4/12/2022 3:55,4/12/2022 3:59,0,100,241,1,4/12/2022 3:59,R_3NBOs9W2UZ8OAls,,,,,anonymous,EN,"Pretty much whatever they want.  No money worries.  No worry about tuition, food, travel...","Cant travel at whim, buy moderate priced items, get a decent loan, pay cash, drive a beater...",14.43,81.537,113.969,4,,,,,,,6,5,4,3,1,3,4,54,0,,1,,39,2,5,5,"Mozilla/5.0 (Windows NT 10.0; Win64; x64) AppleWebKit/537.36 (KHTML, like Gecko) Chrome/108.0.0.0 Safari/537.36",R_3NBOs9W2UZ8OAls
4/12/2022 3:41,4/12/2022 3:59,0,100,1076,1,4/12/2022 3:59,R_3CPWOSniTkWfgKc,,,,,anonymous,EN,,,,,,,They can reach high places. They can ride ever single ride at an amusement park. They're given respect from strangers just because of their height. They're less likely to be the victims of random cases of assault.,They find it difficult to come to grips with their height and are very sensitive about it. It's a sore topic that we can't make jokes about because it ignites their insecurity. They have a harder time with women because of their height.,14.01,363.21,438.077,4,5,6,5,2,1,3,5,19,1,,1,,33,3,3,3,"Mozilla/5.0 (Windows NT 10.0; Win64; x64) AppleWebKit/537.36 (KHTML, like Gecko) Chrome/107.0.0.0 Safari/537.36 Edg/107.0.1418.62",R_3CPWOSniTkWfgKc
4/12/2022 3:29,4/12/2022 4:00,0,100,1834,1,4/12/2022 4:00,R_1jqygOXkXc65dpL,,,,,anonymous,EN,They can travel whenever they like. They can take vacations wherever and whenever they like. They are also able to purchase a new car every year.,They are unable to take vacations. They have to stick to their budget that does not allow for  for social outings. The have not been able to purchase a new car. They only own an old model car.,248.398,432.977,546.719,3,,,,,,,4,2,3,5,1,6,7,53,1,,1,,5,6,4,3,"Mozilla/5.0 (Windows NT 10.0; Win64; x64) AppleWebKit/537.36 (KHTML, like Gecko) Chrome/108.0.0.0 Safari/537.36",R_1jqygOXkXc65dpL
