StartDate,EndDate,Status,Progress,Duration (in seconds),Finished,RecordedDate,ResponseId,RecipientLastName,RecipientFirstName,RecipientEmail,ExternalReference,DistributionChannel,UserLanguage,Q262,Q264,Q272_First Click,Q272_Last Click,Q272_Page Submit,Q272_Click Count,Q265,Q266,Q273_First Click,Q273_Last Click,Q273_Page Submit,Q273_Click Count,Q251,Q252,Q253,Q254,Q271,Q134,Q196_1,Q106,Q108,Q108_2_TEXT,Q268,Q268_2_TEXT,Q121,Q359,Q358,Q250,UserAgent,ResponseID
4/12/2022 3:56,4/12/2022 4:00,0,100,224,1,4/12/2022 4:00,R_C9POQoBpKlLjORH,,,,,anonymous,EN,they cant buy everything they want and they need to save money and budget it,"They save money and be cheap where they can be to save money and resources, and need to save and do things to save money",0.862,48.547,81.441,4,,,,,,,6,6,6,3,1,2,5,26,1,,1,,41,2,5,3,"Mozilla/5.0 (Windows NT 10.0; Win64; x64) AppleWebKit/537.36 (KHTML, like Gecko) Chrome/108.0.0.0 Safari/537.36",R_C9POQoBpKlLjORH
4/12/2022 3:55,4/12/2022 4:00,0,100,290,1,4/12/2022 4:00,R_1MJNnTgwoIQ5xj1,,,,,anonymous,EN,,,,,,,"They are able to reach for anything that they may need in a kitchen, for example. They have no difficulty grabbing items off of tall shelves at the grocery store.",They are unable to reach things on the top shelving in the kitchen without assistance. They need help reaching taller things while at the grocery store and while doing things like painting. ,12.595,92.466,144.998,8,3,1,3,5,1,5,6,29,0,,1,,26,3,5,1,"Mozilla/5.0 (Macintosh; Intel Mac OS X 10_15_7) AppleWebKit/537.36 (KHTML, like Gecko) Chrome/108.0.0.0 Safari/537.36",R_1MJNnTgwoIQ5xj1
4/12/2022 3:56,4/12/2022 4:01,0,100,284,1,4/12/2022 4:01,R_ewCtB0x3PZ2ja4V,,,,,anonymous,EN,,,,,,,They cant get down and crouch down into small doors at play places.  It has no influence on their life unless they want to play with their kids in a play place and have to watch from the side lines.,They are not able to reach the top of the shelf and have to stand on the shelf itself to grab something.,1.351,64.401,65.125,3,7,7,7,2,2,5,6,32,1,,1,,3,3,6,5,Mozilla/5.0 (Windows NT 10.0; Win64; x64; rv:107.0) Gecko/20100101 Firefox/107.0,R_ewCtB0x3PZ2ja4V
4/12/2022 3:48,4/12/2022 4:01,0,100,760,1,4/12/2022 4:01,R_6s1Oz6FLuBx15gB,,,,,anonymous,EN,,,,,,,The tallest person i know struggles to sleep comfortably in bed ,The shortest person I know has social anxiety.,196.521,383.934,436.426,2,7,6,6,2,1,1,6,25,1,,1,,34,3,3,2,Mozilla/5.0 (Windows NT 10.0; Win64; x64; rv:107.0) Gecko/20100101 Firefox/107.0,R_6s1Oz6FLuBx15gB
4/12/2022 3:55,4/12/2022 4:01,0,100,345,1,4/12/2022 4:01,R_3rOrHqeKRahN5uO,,,,,anonymous,EN,,,,,,,"My tallest friend has a much easier time playing basketball than I do, that is for sure. They have a bit harder time sitting in a standard motor vehicle, but on the other hand they never have trouble reaching anything on the shelf at the store. They also often get looks or comments about their height and they really don't enjoy that all that much.","My shortest acquaintance often doesn't want to go to concerts or live events with me because they always have a hard time seeing and getting crowded out by taller people. They often have to ask for help to reach things and have a harder time at the grocery store. Just like my tallest friend, they also get comments and looks that they don't really appreciate.",27.153,103.655,193.173,2,6,5,6,2,1,3,4,42,1,,1,,14,2,5,3,Mozilla/5.0 (Windows NT 10.0; Win64; x64; rv:107.0) Gecko/20100101 Firefox/107.0,R_3rOrHqeKRahN5uO
4/12/2022 3:58,4/12/2022 4:01,0,100,199,1,4/12/2022 4:01,R_1n0DYwTINTLfDoo,,,,,anonymous,EN,They are building their own home. Due to financial reasons they cannot travel as much right now and they have a child,She has two children and is currently a stay at home mom. She has not worked in a couple of years,11.194,14.583,77.578,2,,,,,,,5,7,5,3,1,2,7,27,0,,1,,5,3,5,4,"Mozilla/5.0 (Windows NT 10.0; Win64; x64) AppleWebKit/537.36 (KHTML, like Gecko) Chrome/107.0.0.0 Safari/537.36",R_1n0DYwTINTLfDoo
4/12/2022 3:58,4/12/2022 4:01,0,100,189,1,4/12/2022 4:01,R_22FEg6Lq7amCkFs,,,,,anonymous,EN,,,,,,,"They can do most things, maybe cannot sit comfortablly in a small car or airplane seat. Or sneak around. ",They cannot reach many things. They need a booster pillow in their car. But they can sit comfortably in small spaces,23.875,47.234,70.888,2,6,5,4,2,1,3,7,25,0,,1,,48,1,5,3,"Mozilla/5.0 (Macintosh; Intel Mac OS X 10_15_7) AppleWebKit/537.36 (KHTML, like Gecko) Chrome/107.0.0.0 Safari/537.36",R_22FEg6Lq7amCkFs
4/12/2022 3:55,4/12/2022 4:01,0,100,378,1,4/12/2022 4:01,R_1l6PwDX74te7c6o,,,,,anonymous,EN,,,,,,,The tallest person that I know can play basketball. He can lift high at stores.,The smallest person that I know can squeeze in small places.,28.468,105.172,160.061,6,4,4,3,2,1,4,6,32,0,,1,,42,3,3,2,"Mozilla/5.0 (X11; CrOS x86_64 14092.77.0) AppleWebKit/537.36 (KHTML, like Gecko) Chrome/93.0.4577.107 Safari/537.36",R_1l6PwDX74te7c6o
4/12/2022 3:56,4/12/2022 4:02,0,100,327,1,4/12/2022 4:02,R_2fcFn7OnKgziBsm,,,,,anonymous,EN,,,,,,,The tallest person I know doenst have issues getting things from high shelfs. Their height isnt such a detriment that it affects negativity but they do have easy dealing with tall things ,The shortest person I know has issues getting things off a high shelf. They need to ask for help when shopping as the top shelf is hard to reach. ,30.059,111.618,113.313,4,7,6,7,1,1,1,3,34,1,,1,,21,3,6,3,"Mozilla/5.0 (Windows NT 10.0; Win64; x64) AppleWebKit/537.36 (KHTML, like Gecko) Chrome/108.0.0.0 Safari/537.36",R_2fcFn7OnKgziBsm
4/12/2022 3:56,4/12/2022 4:02,0,100,362,1,4/12/2022 4:02,R_3Duwjel4Z7af4xO,,,,,anonymous,EN,"They can afford to save up for a house while still living a pretty decent lifestyle. Even living in California where the price of living is quite a bit, he has the resources to secure a well paying job and put back money. Despite being fairly well off, they are still quite stingy with their money. They don't want to do much of anything until they can buy a house. ","They aren't able to buy a car to get a job at the moment. They live at home with their mom and sister, and rely on them to pay for most things. They cannot afford dental insurance or to get dental work they really need done. Not having financial resources keeps them from keeping up with their physical and mental health. ",19.631,138.731,230.715,2,,,,,,,7,7,7,1,1,2,4,29,0,,1,,18,3,3,5,Mozilla/5.0 (Windows NT 10.0; Win64; x64; rv:107.0) Gecko/20100101 Firefox/107.0,R_3Duwjel4Z7af4xO
4/12/2022 3:58,4/12/2022 4:02,0,100,223,1,4/12/2022 4:02,R_3gUAb3SX8Risuvp,,,,,anonymous,EN,"They are able to make more out of the box decisions, like flipping houses or starting a business, rather than relying on a standard 9 to 5 job. They are also able to enjoy life more freely since their decisions aren't bound by their bank account. ","They have to work at least 40 hours at a classic 9 to 5 job to pay their bills. Every decision made has to be made with money in mind, so they are very much bound to what they can afford rather than what they truly want. ",8.708,104.892,131.964,3,,,,,,,7,7,7,1,1,1,4,21,0,,1,,10,4,4,5,"Mozilla/5.0 (Macintosh; Intel Mac OS X 10_15_7) AppleWebKit/537.36 (KHTML, like Gecko) Chrome/107.0.0.0 Safari/537.36",R_3gUAb3SX8Risuvp
4/12/2022 3:59,4/12/2022 4:02,0,100,160,1,4/12/2022 4:02,R_3JKqc5sUaxH72W5,,,,,anonymous,EN,"They can retire right now at 30 years old. Their parents provide all their living expenses, housing, job security. They do not have to worry about food, or cooking, or cleaning the house. They can focus on their hobbies after work.","They cannot buy a house, they are forced to always buy the cheapest items at the grocery store. They have difficulty fixing their car because of lack of savings.",9.003,9.003,76.182,1,,,,,,,6,6,7,2,1,3,7,32,0,,2,Suriname,23,5,6,5,"Mozilla/5.0 (Macintosh; Intel Mac OS X 10_15_7) AppleWebKit/605.1.15 (KHTML, like Gecko) Version/16.1 Safari/605.1.15",R_3JKqc5sUaxH72W5
4/12/2022 3:56,4/12/2022 4:02,0,100,375,1,4/12/2022 4:02,R_3PZA20YE2483s60,,,,,anonymous,EN,"My cousin.  He can pretty much live a life with a big home, trips and has a high quality of material life.  He can't really enjoy things that are of no monetary value.  He has no children, so his focus is on material things.  ","My brother.  He has no income and is dependent on social services and the VA.  He is unable to leave his apartment, unless transportation is arranged and paid for.  He has no financial resources and that creates quite a bit of stress.",15.418,129.176,220.739,2,,,,,,,4,1,2,2,1,6,7,59,0,,1,,45,5,3,5,"Mozilla/5.0 (X11; CrOS x86_64 15117.111.0) AppleWebKit/537.36 (KHTML, like Gecko) Chrome/107.0.0.0 Safari/537.36",R_3PZA20YE2483s60
4/12/2022 3:57,4/12/2022 4:03,0,100,321,1,4/12/2022 4:03,R_11cQcH2jvRPZ0D2,,,,,anonymous,EN,"The person I know who has the most economic resources has much more freedom in their day to day choices. Instead of having to clean their house on their own, they can pay someone to come in and professionally clean it on a recurring basis. Similarly, they can pay someone to take care of their lawn and other tasks. Due to this persons large amount of economic resources, they are able to use their large amount of financial wealth to essentially ""buy back"" their time and avoid doing basic housekeeping other people have to do. Furthermore, this person is able to do basic tasks such as grocery shopping without having to really worry about the prices of goods.",In comparison the person I know that has the least economic resources has to spend much more of their time on basic tasks that consume their time. Furthermore do to their limited resources they have to be much more careful about their spending. Even with careful spending one unforeseen bill or a sudden bill to repair their car could very easily destabilize their life and cause them to be in severe debt.,12.592,204.87,216.633,4,,,,,,,6,6,6,3,1,3,7,21,1,,1,,10,7,2,4,"Mozilla/5.0 (Windows NT 10.0; Win64; x64) AppleWebKit/537.36 (KHTML, like Gecko) Chrome/108.0.0.0 Safari/537.36",R_11cQcH2jvRPZ0D2
4/12/2022 3:56,4/12/2022 4:03,0,100,431,1,4/12/2022 4:03,R_1ewXo99QpQ7ufhl,,,,,anonymous,EN,"My mom is well off.  She lives in a beautiful newer home (no mortgage) on 120 acres.  She has money inherited from my grandpa.  At this point, she can basically buy what she wants or needs without worrying about the future. She has no debt and is generally wise with how she spends her money.  She is also very generous with her kids.","She is on government assistance - SSI and food stamps.  She has no outside money or ways to earn money.  She lives with her brother who is also the same way.  They live in low income housing.  She does not think carefully about how to spend her money and lives paycheck to paycheck.  Sometimes she buys something like cable, new phone, etc. and I cringe on how wasteful it is.  Sometimes she has $5 to her name and has to wait a week or two until she gets SSI again.",15.721,197.222,318.336,4,,,,,,,7,1,1,7,1,6,6,47,0,,1,,51,6,5,5,"Mozilla/5.0 (Windows NT 10.0; Win64; x64) AppleWebKit/537.36 (KHTML, like Gecko) Chrome/108.0.0.0 Safari/537.36",R_1ewXo99QpQ7ufhl
4/12/2022 3:55,4/12/2022 4:03,0,100,492,1,4/12/2022 4:03,R_YXE3xYZJo7sIt4l,,,,,anonymous,EN,"They receive money from a trust fund.  He works, but his trust fund income far exceeds his employment income.  They recently bought a second lake house so they can enjoy the lake even when other family members are using the first lake house.  He has a nice pickup truck that he treats roughly because he can afford to simply buy a new one if his current one breaks.  When one of the kids became interested in basketball, they built an indoor half-court attached to their house so he could practice in it.","They are each working 2 jobs, so they can't usually do anything normal couples do.  They are often invited to get-togethers, but can't come.  They have also had to borrow money for things like car repairs, or to replace failed appliances.  They've told me that they feel they pay more for things because they only buy when they need something, and can't wait for better deals or sales.",1.126,381.176,382.176,7,,,,,,,6,5,2,2,1,3,4,47,1,,1,,51,5,3,4,"Mozilla/5.0 (Windows NT 10.0; Win64; x64) AppleWebKit/537.36 (KHTML, like Gecko) Chrome/108.0.0.0 Safari/537.36",R_YXE3xYZJo7sIt4l
4/12/2022 3:57,4/12/2022 4:03,0,100,367,1,4/12/2022 4:03,R_3M35C5E91jEziNA,,,,,anonymous,EN,,,,,,,"The tallest person I know can easily reach things that are on high shelves without having to strain himself. If he went to a concert, he would not struggle to see the stage since he would probably tower over most of the crowd. However, some things would probably be inconvenient for him. For example, tables would be too short and he would have to bend a lot when sitting down to write something. For the most part, though, I think his tall height is an advantage in his life, especially because he is a man and most women prefer taller men.","The shortest person I know struggles a lot because of her height. Whenever she is in a crowd, it is very difficult to spot her and she wouldn't have a good time at most concerts since she would be shorter than majority of the crowd. She also has trouble reaching a lot of things. However, she's able to fit into a lot of small spaces.",4.893,239.365,261.605,13,6,6,6,2,1,2,3,20,0,,1,,33,2,2,3,"Mozilla/5.0 (Windows NT 6.1; Win64; x64) AppleWebKit/537.36 (KHTML, like Gecko) Chrome/107.0.0.0 Safari/537.36",R_3M35C5E91jEziNA
4/12/2022 3:58,4/12/2022 4:03,0,100,343,1,4/12/2022 4:04,R_3ELpYvVoEMp0NHa,,,,,anonymous,EN,,,,,,,The tallest person I know is my friend Brian. There is nothing he can't do. Women tend to consider him attractive due to his height. ,The shortest person I know is my friend Michael. I know to combat his height he started to work out a lot. ,5.905,53.401,77.784,2,7,2,5,4,1,6,8,30,1,,1,,23,6,6,5,"Mozilla/5.0 (Windows NT 10.0; Win64; x64) AppleWebKit/537.36 (KHTML, like Gecko) Chrome/108.0.0.0 Safari/537.36",R_3ELpYvVoEMp0NHa
4/12/2022 3:58,4/12/2022 4:04,0,100,347,1,4/12/2022 4:04,R_3D0FO8BiYBGc05b,,,,,anonymous,EN,"The person I know with the most resources isn't wealthy exactly but definitely upper middle class. She has savings, can cover an emergency, and can usually buy what she wants, including maintaining an in-ground pool.","The person I know with the least economic resources can't cover an emergency on her own, isn't much able to save up money, and can pretty much never buy what she wants. She can mostly just cover bills and food, and then there's nothing left.",51.289,239.872,242.964,5,,,,,,,7,5,5,2,1,3,3,25,0,,1,,48,2,3,4,"Mozilla/5.0 (Windows NT 10.0; Win64; x64) AppleWebKit/537.36 (KHTML, like Gecko) Chrome/107.0.0.0 Safari/537.36",R_3D0FO8BiYBGc05b
4/12/2022 3:57,4/12/2022 4:05,0,100,487,1,4/12/2022 4:05,R_2QMbprtV6WyNJkl,,,,,anonymous,EN,My friend is wealthy.  She would like to be wealthier.     She is not in good health and is narrow minded so the money to her is for immediate concerns of someone who is a shopping addict.  She and her siblings buy whatever they want.  She has a lovely home and buys whatever she wants.  She does not have to worry about not having enough money or searching for sale items or bargains.  It is a nice life for her but it is not for me.,"I am the person I know with the lease economic resources.   I have made some progress to get out of my economic downfall of ten years ago but not enough.  I can pay my bills, and have paid off most of my debt. I don't own a house or a car.  I don't have disposable income. I am 70 I have kids and grandkids and am wealthy in that way.   But I have been working for so long to be able to do some of the things I have not been able to do for so long.  I am still optimistic and motivated.  I am a good bargain shopper!",1.481,185.713,323.971,3,,,,,,,7,7,7,1,1,2,6,70,0,,1,,39,1,3,5,"Mozilla/5.0 (Macintosh; Intel Mac OS X 10_15_7) AppleWebKit/537.36 (KHTML, like Gecko) Chrome/107.0.0.0 Safari/537.36",R_2QMbprtV6WyNJkl
4/12/2022 4:00,4/12/2022 4:05,0,100,283,1,4/12/2022 4:05,R_2WIjyv9B3iHZCdN,,,,,anonymous,EN,,,,,,,My partner is the tallest person I know and they’re able to feel safer in public. They can scope out crowds and have a greater sense of their surroundings. However they can’t squeeze into tight places.,I’m the shortest person I know. My peripheral view is different from others and I feel less safe in public especially in crowds. I have more limitations when it comes to reaching for things.,10.027,69.598,137.98,2,6,4,3,5,1,3,7,25,0,,1,,7,7,5,3,"Mozilla/5.0 (iPhone; CPU iPhone OS 15_6_1 like Mac OS X) AppleWebKit/605.1.15 (KHTML, like Gecko) Version/15.6.1 Mobile/15E148 Safari/604.1",R_2WIjyv9B3iHZCdN
4/12/2022 4:02,4/12/2022 4:05,0,100,188,1,4/12/2022 4:05,R_2yrWmChryjFWwNX,,,,,anonymous,EN,The person with the most economic resources are allowed the freedom to purchase expensive items that can help them in life. ,"The person with the least economic resources are unable to live freely if they are in debt. If not, then they can live a normal life even without mass resources.",4.905,34.333,131.945,3,,,,,,,5,5,5,3,1,4,5,24,1,,1,,45,4,5,3,"Mozilla/5.0 (Windows NT 10.0; Win64; x64) AppleWebKit/537.36 (KHTML, like Gecko) Chrome/108.0.0.0 Safari/537.36",R_2yrWmChryjFWwNX
4/12/2022 4:00,4/12/2022 4:05,0,100,358,1,4/12/2022 4:05,R_1pVBfrZfa9ffvGz,,,,,anonymous,EN,,,,,,,"I know that doorframes and other similar spaces have caused problems for him with almost or actually hitting his head on them sometimes, and he's not often able to use things like amusement park rides because of it too. In general, though, he doesn't seem to mind being so tall, at least not from what I can tell.","He sometimes has trouble grabbing things, particularly in stores, on higher shelves and such. Until he started to get some gray hair and a full beard, he also was sometimes thought to be younger than he was, which made getting things like alcohol or cigarettes more hassle than he'd like. I know for a fact, though, that he likes being short and doesn't consider these things to be a bad problem.",26.499,26.499,185.9,1,5,3,3,5,1,5,6,43,1,,1,,15,1,2,2,"Mozilla/5.0 (Windows NT 10.0; Win64; x64) AppleWebKit/537.36 (KHTML, like Gecko) Chrome/107.0.0.0 Safari/537.36 Edg/107.0.1418.62",R_1pVBfrZfa9ffvGz
4/12/2022 4:02,4/12/2022 4:06,0,100,197,1,4/12/2022 4:06,R_25vB3Y3RSk9aOVf,,,,,anonymous,EN,,,,,,,"The tallest person can play basketball much easier, as they do not have to jump as high. This comes at a cost of them having to duck in smaller cars and struggle to get in and out of them.","The shortest person I know sometimes struggles to reach high places. Other than stuff being up high, they have no other influences affecting them.",11.487,73.537,109.932,5,6,6,7,1,2,3,7,21,1,,1,,45,4,5,1,"Mozilla/5.0 (Windows NT 10.0; Win64; x64) AppleWebKit/537.36 (KHTML, like Gecko) Chrome/108.0.0.0 Safari/537.36",R_25vB3Y3RSk9aOVf
4/12/2022 4:01,4/12/2022 4:06,0,100,291,1,4/12/2022 4:06,R_3Dq0m4FLYQdRhBQ,,,,,anonymous,EN,We have two friends that have a lot of money at the current time. They have a second house and are able to fly back and forth to enjoy both homes. They honestly go whatever they want when they want to do it.,My dad and stepmother have the least amount of money than anyone that I know. They spend more money then they have coming in. They have always lived above their needs.,7.134,119.837,167.94,5,,,,,,,3,2,6,6,2,6,6,49,0,,1,,31,6,5,3,"Mozilla/5.0 (Windows NT 10.0; Win64; x64) AppleWebKit/537.36 (KHTML, like Gecko) Chrome/107.0.0.0 Safari/537.36",R_3Dq0m4FLYQdRhBQ
4/12/2022 3:59,4/12/2022 4:06,0,100,441,1,4/12/2022 4:06,R_UrmJr82py1NlNmx,,,,,anonymous,EN,,,,,,,"They can do many things, reach high shelves, get a lot of guys because height is seen as attractive. I think it enhances a lot of things. There is a negative influence in their self image. I think they feel too tall and lanky, don't always seem to feel comfortable in their body and height.","The short friend also feels a bit uncomfortable in their shortness and self-image. They have difficulty with reaching certain things and having access. On top of that, they do not like having to ask other people for help with height-related difficulties.",17.335,201.192,305.329,2,7,7,6,1,1,2,5,24,1,,1,,14,1,5,2,"Mozilla/5.0 (Windows NT 10.0; Win64; x64) AppleWebKit/537.36 (KHTML, like Gecko) Chrome/108.0.0.0 Safari/537.36",R_UrmJr82py1NlNmx
4/12/2022 3:38,4/12/2022 4:06,0,100,1701,1,4/12/2022 4:06,R_3kKT6FxvO30xxnq,,,,,anonymous,EN,,,,,,," The advent of a tallest person in my life seem very nice in view of ways of life, having this close friend
around and knowing his movement along his characters says a lot how close. 
  Dave seem humble with life he does things at his own convenient time frame hate been cheated or take advantage to gain at your own interest so i found him be tall not a predicament to good character.","  I do have short people as friend on daily base so contemplating what they can do would not go 
without stating fact of what they cannot do, i have this friend which i consider been the shortest we so 
have a lot of arguments on specific issues very stubborn never care to take to correction every of his decision seem right. 
  I would say this is the only issue i would say about him very decisive only on his action without other
advice.",64.031,946.076,976.53,31,2,5,6,2,1,2,5,50,1,,1,,5,2,6,3,"Mozilla/5.0 (Windows NT 10.0; Win64; x64) AppleWebKit/537.36 (KHTML, like Gecko) Chrome/97.0.4692.71 Safari/537.36",R_3kKT6FxvO30xxnq
4/12/2022 4:02,4/12/2022 4:07,0,100,310,1,4/12/2022 4:07,R_1CHMqXhtSrihGCM,,,,,anonymous,EN,"They can do a lot. She reached six figures in her salary so that gives her a lot of financial freedom. She was able to buy a brand new car with add-ons so it was quite expensive, and she probably would not have done so without the salary. She was also able to stay in her one bedroom apartment when she had to start living alone which most people could afford. In general it gives her financial freedom and flexibility.","She has the least economic resources but still isn't poor by any means. We're all lucky enough to be able to live, feed, and clothe ourselves, but this leaves her less room for any sort of trip or travel, and means she's more locked in the certain living situations",1.284,161.505,196.584,6,,,,,,,7,5,7,1,1,1,8,25,0,,1,,38,3,5,3,"Mozilla/5.0 (Windows NT 10.0; Win64; x64) AppleWebKit/537.36 (KHTML, like Gecko) Chrome/108.0.0.0 Safari/537.36",R_1CHMqXhtSrihGCM
4/12/2022 4:00,4/12/2022 4:07,0,100,429,1,4/12/2022 4:07,R_380hI5V4yqBQZDH,,,,,anonymous,EN,"The person I know who have the most economic resources seems to be able to get their hands on anything they wanted, no matter how expensive it is. I have seen them take multiple classes/activities that seem to be way out of budget compared to others and change it with little thoughts. They went on to get a great education and wedding and seem to be doing well. ","The person I know seems limited, almost always at home or work. The free time they do have they spend it usually sitting at home, watching T.V or drinking. Their relationship with their partner also isn't the best but divorce seems to be off the table because of costs. They feel stuck because the lack of money.",18.349,213.869,313.84,5,,,,,,,7,7,6,2,1,3,4,28,2,Nonbinary,1,,46,3,3,4,"Mozilla/5.0 (Windows NT 10.0; Win64; x64) AppleWebKit/537.36 (KHTML, like Gecko) Chrome/107.0.0.0 Safari/537.36 Edg/107.0.1418.62/8PqWwXDI-07",R_380hI5V4yqBQZDH
4/12/2022 4:00,4/12/2022 4:07,0,100,389,1,4/12/2022 4:07,R_0O4WbchTRqpQZ4B,,,,,anonymous,EN,,,,,,,"This person can reach things that are high up, that I normally wouldn't be able to reach. However, they cannot stand and wash dishes for too long, because they have to hunch over the sink and it hurts their back. They are also sometimes cramped in showers because most of the showers are too small and the shower head is lower than them.",This person can get into smaller spaces to reach things or to get into crawl spaces. They have trouble finding a significant other because of their height. A lot of people have told them that they are too short to date.,15.513,15.513,213.941,1,6,4,5,2,1,2,8,31,0,,1,,38,5,2,5,Mozilla/5.0 (Windows NT 10.0; Win64; x64; rv:107.0) Gecko/20100101 Firefox/107.0,R_0O4WbchTRqpQZ4B
4/12/2022 4:03,4/12/2022 4:07,0,100,246,1,4/12/2022 4:07,R_3iKJb0Qs4A9KMYy,,,,,anonymous,EN,"This person sacrifices a lot of time to work for their economic resources, but in return they do not have to think about purchases of new items/games/food/etc. Their child has all of their needs met. They were able to buy a home, and have a solid investment plan. If they didn't have to work, they would theoretically be able to travel around the country.","This person can't often go to events that involve travel as it's not in their budget. They have to take the bus, which increases their commute times to work and forces them to stand outside in cold weather, and deal with transfers. They have to sacrifice a lot of time at work, and at times had considered picking up a second job to make rent. ",2.436,173.048,176.314,5,,,,,,,7,7,7,1,1,2,4,26,2,NB,1,,39,4,5,4,"Mozilla/5.0 (Windows NT 10.0; Win64; x64) AppleWebKit/537.36 (KHTML, like Gecko) Chrome/106.0.0.0 Safari/537.36",R_3iKJb0Qs4A9KMYy
4/12/2022 4:01,4/12/2022 4:07,0,100,364,1,4/12/2022 4:07,R_3338nzH2QGo5Wlt,,,,,anonymous,EN,My oldest daughter has a lot of resources because she makes good money.  She could do just about anything she chooses.  She has a car and is buying her own house.  ,My youngest daughter has no extra money because she drinks a lot.  She can't even help me.  she wouldn't be able to do anything. ,47.889,162.283,194.626,10,,,,,,,7,4,6,2,1,4,3,71,0,,1,,36,1,1,4,"Mozilla/5.0 (Windows NT 10.0; Win64; x64) AppleWebKit/537.36 (KHTML, like Gecko) Chrome/107.0.0.0 Safari/537.36 Edg/107.0.1418.62",R_3338nzH2QGo5Wlt
